User_ID, Generative Adversarial Networks, Redaction for Data Minimization,Processor Pipelining,CSS and JavaScript optimizations, Google Slides,Kanban,Software Development Life Cycle,Eigenvectors,Whiteboarding,JSON Parsing,Custom Views,Microservices with Kubernetes,KnockoutJS,Oracle Autonomous Database,Ethereum Blockchain,SparkSQL,DOM Structure,Multithreaded Programming, Data Loading with SageMaker,UI,OCI CLI,React Component State, PostgreSQL,Virtual Memory,Building web applications,Technical Interview, novel cloud services,AI Fairness, Search Engine Optimization, Network Security Fundamentals,Engagement,Basic elements of cryptography,iOS,Research Methods,Underscore's template function, React Native Basics, Data Minimization, Object Detection,Smart Beta, Phishing,IndexedDB asset caching,Spark,Building Ember apps,Offline apps, IT Infrastructure Modernization, Data Analytics Expressions,jQuery,Distributed Systems, NIST Cybersecurity framework,Interview Practice Problems, Google Chat, AI Transparency,Using an Organizational Library, Brand Design,JOINs,Power Automate,Docker,"Access
Management", HTML,Kalman Filters, Sensitive Data Tracking,Segmentation,Resume writing, Apache Airflow,Self-Driving Cars,3D Medical Imaging, Service Level Indicators,TensorFlow Lite,User Interaction,API development, Security Risk Classification, Cloud Migration,HTML5 Canvas, Backup Strategy, Temporal Difference,Creating an API,Backbone events and routing, React-Redux Bindings, Requirements gathering,Android Studio,Encryption, and operations.,CRUD, Non-Disclosure Agreements,Spring Boot,Simultaneous Localization and Mapping,pandas, Deployment,Data Dashboards,Revenue Models,Window Functions,Design,Virtualization,DOM and CSSOM,SQLite,Facebook SDK,HTTP,Entrepreneurship,Notifications,Focus,Java Functions,Risk,Team Management,Cloud Infrastructure,User Interface Design,Idle and Load (RAIL), Activation Strategy,Robotics,Building Angular apps,Database, Bounding Boxes,Natural Language Processing,Common FS Questions, React Router,Object-oriented programming,Product Development,Sentiment Analysis,Pandas & NumPy,Questioning,Syntax,Computer Vision, Cybersecurity Risk Management, Machine Learning Fluency, Product Monetization Metrics, Data Pipeline Creation,Node,Robot Control,Computer vision, Search Engine Marketing,MongoDB,Networking,Privacy by Design Framework, DiD Framework, Object-oriented programming,Sensors,Image Classification, Cloud Cost Evaluation, Privacy Risk Assessment, Container Vulnerability Management,Modeling,Android,Object-oriented Programming,Web App Manifest,Data Formatting,Data Structures and Algorithms,Black-Box & White-Box Testing,Semantic Networks,C++ Templates, Test Automation, Jest,HTML,Optimizing JavaScript,Salesforce App Development,Editing commits,Object Tracking, Product Management,Smart Grid Infrastructure,Flexbox, OCI Compute and storage,Kotlin,Logic and Planning,Unsupervised Learning,Prediction,Sequential Query Language, PyTorch,Kubernetes,Mobile Image debugging, and serverless architecture,Deep Deterministic Policy Gradients (DDPG), Search Algorithms,Dataflow Analysis,Solving algorithmic problems,Python Package Index,Numpy & Pandas,Direct Manipulation Interfaces,Feature Selection,Deep Learning Models,Version Control,Data Analysis, Facial Recognition, leadership, JavaScript objects,Apache Storm, Disaster Recovery Plans, Automated model scoring,Periodic Motion,Gmail, Angular, JavaScript Functions, Zero Trust Algorithms, Elevator pitches,Algorithms,Firebase Crash Reporting,Kafka,High Availability Infrastructure, Automated Cloud Cost Optimization,Agile Development Methodology,Value Proposition,Feature Engineering,A/B Matched Pair Design Tests,QMV Process,LinkedIn, React Design Patterns,Installing Sublime Text, Marketing fundamentals, Architecture Diagramming, Google Docs,Lidar,d3.js, Exadata infrastructure,Validation, project management skills,HTTP headers and verbs,Clustering, web server, Text Processing in Python,Advanced error handling,Serverless Computing, Cost-benefit analysis, vulnerability assessment,CSS, Time-Series Analysis with ML, Digital marketing metrics, Data privacy best practices,Usability Testing, Growth Loops, Display Ads,SQL Basics,Partitions,Visuospatial Reasoning,Asynchronous Programming,Understanding Lie-Fi,Continuous Integration,Ajax with Fetch,Public Policy,Domain Name System, Data privacy fundamentals, Oracle Resource Manager, AWS Data Warehouse,Convolutional Neural Networks, Natural Language Processing, Deployment Rollback, Model Training, Conversational AI,Service Worker DevTools, I/O,Acquisition Strategy,Data Architecture,red-green-refactor workflow,Customer Acquisition,Operating Systems,Data and functionality,DDL,Non-Binary Classification Models,Object Constraint Language,Digital transformation,UI/UX, Security Devices,Software Security, Data Anonymization,Shared Memory Models,Git & GitHub,T-tests,scikit-learn, Online Analytical Processing,Annotating Datasets, Invoicing,AWS DeepRacer,AWS Glue, OS management,AWS,C++,Asynchronous code,Zero Trust Pillars, Continuous Delivery,Binary Classication Models, Oracle Machine Learning, Application State Management with Redux, Observability,Data Auditing,Pointers and Arrays, Cloud Operational Efficiency, management, Data Lifecycle Management,Waterfall project management,Functional Programming, IT Asset Management,Modular code, Cloud Automation,LLDB, Project scoping, Java modules, API Security,Software Design, Zero Trust Security Model, Data Version Control,Firebase Analytics,Inferential Statistics, Social Media Presence, Cloud Architecture Model Types, Azure Key Vault,Entity relationship diagrams, Email marketing,Edge AI,Database Normalization, Cybersecurity Policy Writing,Interview practice, Cybersecurity incident response playbooks, Data Pipeline DAGs,Real-Time Operating Systems,Swift programming,Intersections,Creating a narrative, Face Detection,Graph API,MapReduce, React Component State, Fetching Data,Reinforcement Learning for Trading,HTTPS,Remote Work,MVC Design Pattern,Scrum,Computer Image Generation, Building SRE Teams, Model Bias Analysis,Computational Investing,Game Theory,Google Maps APIs,TensorFlow,Trigonometry,Continuous Integration / Continuous Deployment,Dynamics, Planning,Performance,Inter-Process Communication,Pyschology,Career Advancement,Control,Regression, Autoencoders,VCN, Basic JavaScript scripts, Data Lakes, Go language fundamentals,Data Issues, and SQL Developer Web, Product Monetization Strategy, Data loss prevention,Markov models,Git,Web APIs,Symbolic Execution,UserDefaults, Results Analysis,Unix-style command-line environment, Cloud Security Fluency,Product Strategy,Go programming," 
Geo-Replication",Tableau,Hierarchical Memory Models,Cost-Benefit Analysis,Animated 3D Demo Program, Intent Recognition,Service Workers, Node.js,Pandas,Customer Segmentation,Operating System Kernels,VR development, Software Testing,Part of Speech Tagging,Perception, Oracle Text,LSTMs,Database Management Systems,Sensor Fusion,Asynchronous requests with JavaScript, Regional Privacy Regulations, Observability Best Practices,OAuth 2.0,Accessibility,Monetization,Design Sprints, Manage custom images,Clustering Models design,Personal branding,UX Design,Product Launch, Azure Cognitive Services,Process Automation, Freelance Pricing Frameworks,Differential Register Allocation, cryptanalysis and systems security,Prototyping, Partially Observable Markov Decision Processes (POMDP),Constraints, Activation Metrics,Making code easier to read,UiPath Studio,Game Development, Data Privacy Fundamentals,Interview Preparation,Apollo HD Map,User interfaces,3D Motion Planning, concurrent programming,Privacy Impact Assessments,Data Types & Variables,Schema Building,Synchronous Programming, basic backend,Firebase Dynamic Links,Algebra, Network security,Planning,Code organization,APIs,XP, Data privacy checklists,Model-View-Controller,Forecasting,ARIMA Models,Common Android Questions,Path Planning and Control,Ajax with jQuery,PostgreSQL,Time Series Forecasting,Statistical Research Methods,Javascript Apps,Localization at Google,App Store,Mental Models, Operational Data Stores, React Hooks,Reinforcement Learning,Power BI, N-tier applications,Linux,Denormalized Data Schemas, Serverless Functions, Self-Healing System Design,Instruction Scheduling,Data APIs, Extract-Transform-Load,Rest API,Cloud Computing,Data Visualization, security research,Agile,Authorization,Animation,Firebase Remote Config,Prototypal inheritance,Introduction to Machine Learning,Bayesian Networks,Automated ML, SageMaker JumpStart,CursorAdapter & CursorLoader,Data Center Networking, Optimization Algorithms, k-anonymization,Research HTML5 input types, Premium Value,Debugging,Agile Management,GCD, Ethical AI, Aggregation, cloud governance model,ESLint,User Experience, threat modeling,Cloud Security, Bayesian networks,ES6,App Deployment, Backtracking Search,User-Centered Design,Flask,Data Cleaning,Webpack, Data privacy regulations,UiPath Orchestrator, Cybersecurity controls, load balancer and traffic management, Constraint Satisfaction Problems,Cleaning Data, Recurrent Neural Networks, Azure Defender, support model, ETL, Incident Response Playbooks,Congestion Control,Jasmine testing framework,DML, Reliability Reviews,Conditionals, Formal Written Communication, Cloud Cost Governance, Model testing, Perimeter Security,Java,Targeting your pitch,Validate user input using JavaScript,Content Distribution,Product Design, Facebook Marketing,Unified Modeling Language,Google Translator Toolkit,Object Oriented Javascript,AI Products,Storytelling,Momentum Trading Strategy,Interactive Design, operational efficiencies,Azure Security Center, Zero Trust Maturity Model,Feature Transformation,Probability,CSS media queries, Azure Resource Manager,ROS, JavaScript arrays,Speech Recognition,Computer Program Design, Team development,Workforce Training, OCI compliance structure,Common iOS Questions,CloudFormation,Google Cloud Fundamentals," Data Governance
",UIKit,Differential Equations,Authentication,Spark Dataframes,Data Manipulation, Platform as a Service,C++ Standard Library,Static Maps,Databases,Design Sprint, Video advertising,PyTorch, Azure,Live Editing,Core ML, Machine Learning Framework Fundamentals, Cloud Hardening Strategy,Resource Virtualization, Reinforcement learning,Data structures,Collection Views,Distributed Cognition, Data Encryption,Rational databases,Interview questions,Artificial Intelligence,Common VR Questions, Data Lake Architecture,Gradle,Writing organized code,Electronic Health Record Data,Wearable Device Data, Tiers of Deletion,Network Processors,NP-completeness, security threat mitigation, Redshift,ContentProvider, data modeling, autoscaling,Screen Readers,IP addressing,Distributed Memory Models,Path Planning,User Journey Maps, Social Engineering, Spatial,Creating responsive graphics,URLSession,Simultaneous Localization & Mapping, Minimax Search,Hadoop,Python DB-API,Hypothesis Testing,Compilers,Semantic Analysis, Docker,VLIW Architecture,Prototyping a Product, Project execution,FileManager, Form Recognition,Python, Continuous Integration,Health Care Applications, Requirements Gathering,HTTP/1 and HTTP/2 capabilities, Microservices, Data Modeling Basics, Deep Learning Techniques, CI/CD,CNNs,Portfolio Websites, Prometheus,Customer Segments,Statistics, Key Phrase Extraction,Feature Detection & Matching,Security Vulnerabilities,Virtual Machines,MySQL,HTML Syntax Problem Set,Design Process, Google Analytics,Creating animation,Business Strategy,AutoLayout, Model Bias Mitigation, Privileged Identity Management, Databases and SQL, CSS,Graph Algorithms,Unity,2D Medical Imaging,Critical Rendering Path HTML, Growth Strategy,Cryptography,Localization,Firebase, Explainable AI,Time Series Analysis,Industrial Control Systems,Python API,Gathering Data,A/B Randomized Design Tests,SLAM, Data Privacy Regulations,CSS Syntax, Big Data Fluency,User Research,Bootstrapping, OLAP Cubes,Assessing Data,Privacy,Heroku,Common Data Questions, Strategic communication plans,Semantics,Data Modeling, SQL Joins, Azure Form Recognizer,  project management lifecycle,Digital project management basics,Single Page Applications,Robot Operating System,Power Apps,Relational and Non-Relational Databases, Apache Spark,Machine Translation,Control Flow, Image Classification,Parallel Algorithms,Vulnerability Management, OCI security model,Azure Machine Learning SDK,Variable Reduction,Product Management,Microservices,Databases and data stores,Deep Q-Networks (DQN),Data Indexing,Object-Oriented Programming,Authentication & Authorization,Front-End Development Basics, Cybersecurity Fluency,Traffic Shaping, Hyperparameter Tuning,Threat Modeling,Memory Ordering,Software-Defined Networking,Ping,Chrome Developer Tools,Relational Algebra, Google Drive,Mobile Design,Classification & Recognition, Amazon S3, Supervised & Unsupervised Learning,Distributions,Device Hardening Strategy, Project management tools,Asset management,Installing Plugins,Subqueries, Gantt charts,Design of Visualizations,Evaluation Metrics,Optimization,Big Data,Design Principles,Ideation and Research,Company targeting,Excel & Spreadsheets, Branding strategy,Kinematics,Separating concerns, Relational Data Design,Functions, Goroutines,RESTful interfaces,Responsive Images,Controls,Logic & Planning,Cyber Security,Google Analytics, Cloud solution,Usability, Distributed Model Training with SageMaker,Supervised Learning, Cloud Computing Fluency,Control Flow Analysis, Access Control Matrices,Web Applications, Resumes, Vulnerability Assessment,Browser Rendering Response, Penetration Testing,Analytics,Training ML Models, AI Algorithms,File Systems,Stereo Geometry,Ruby,DOM,Problem Solving,OOP, Grafana, Data Innovation, Incident Management,Common FE Questions,App Marketing, Image Generation,Design Patterns,Compliance, Microsoft Bot Framework,Object Detection,Constraint-based Analysis, SQL and SQL scripting,Java Programming, Cloud Resource Allocation,Modify HTML attributes and content, REST API,Deploying services,Industrial Networks, Data Pipeline Maintenance, Neural Network Basics, Code Debugging,Data Persistence,Concurrency,Local Persistence,Data Structures,Distributed File Systems, Terraform,Sinatra, Application Modernization,ETS Models,Common-Sense Reasoning,Swift Package Manager,Asynchronous Data Retrieval, Cohort Analysis,Location Services,Classification, Capacity Management, incident detection and handling,Basic Cybersecurity Implementation,2D,Linear Regression, Social Media Marketing,Azure Machine Learning, Professional Networking,Communicating value,Loops, Data cleaning, Reconnaissance,Generating sequences of async work,Information Theory, Machine Learning Pipelines, Data privacy classification,Ciphers, Deep Learning Fluency, cloud center of excellence,Account Kit,Gulp,Incident Response,Digital Marketing, Message Passing, Data privacy governance, Cybersecurity Compliance,Mapping,Image Processing,Native JavaScript Promises, Long-short term Memory Networks,App Development, Data Warehouse Architecture,Estimation,Automated Testing, Target Personas,theoretical computer science, Incident Post-Mortems,Real-time Analytics,Microsoft Power Platform,Closures, Technical cybersecurity controls,Data Analytics, Open-source intelligence,Data Labeling,Optimizing layout,Software Engineering,Analogical Reasoning, Procedural cybersecurity controls,How to debug an app,Multiprocessor Architectures, Cybersecurity Training Strategies, and Graph,Data Streaming,Matplotlib,Data Science, Azure Pricing Calculator, Command Line Interface Basics,Biology,Data Structures & Algorithms,monitoring API usage,Vehicle Motion,Automation with Pipelines,Datalist input,Infrastructure as Code,REST APIs, Argo CD, Network Security Architecture,Strings, Secure Network Architecture Design, Python Syntax,Probabilistic Models,app publishing,Blockchain Architecture,General understanding of how VR works, Agile Planning,HTTP request and response cycle,Markdown,Microservice architecture,User Input,Exploratory Data Analysis,Progressive Web Apps, Google Meet, TypeScript, Application Development Best Practices,A/B tests,Deploying Microservices,Optimizing forms, Convolutional Neural Networks, Data Extraction,Optionals,Software Testing,Intel OpenVINO, Backpropagation,Site Customization,Social Networks,ANOVA,Remote debugging and emulation,CSS flexbox,Producing templated output,Software Architecture,Security controls,Descriptive Statistics,IndexedDB,Responsive design patterns,TCP/IP stack,Processes & Threads,Human Capital, Github Actions,Neural Networks,iOS networking,LibGDX, Responsible AI,Google VR SDK for Unity, Agile frameworks, SMART goals, System and Application Auditing,Control Flow Syntax, DevTools,Android Development,Constraint Propagation,Automated Debugging,README,OCI,NumPy,Azure AI Builder,Ajax with XHR,Data Wrangling,Select and insert statements, reflection, Basic Spreadsheet Use, OCI service offerings,Stack Views,Swift, Relational data modeling,"Machine Learning Operations
",Requirements Engineering,Secure user account systems,numpy, Experiment Design,Branch Prediction,Client-Server Communication,Syntax Directed Translation,Linear Algebra,Street View imagery, Microservice Design,JavaScript,Testing,Multithreaded Processing,Math,Governance,Machine Learning,SQL Injection,Ideation and Validation, Cybersecurity Regulations and Standards,Visual Encodings, Pattern Recognition,Radar,Message Passing Interfaces,Motion Planning," Azure Pipelines
",Configuration Management with Ansible,Spark Streaming, Service Agreements,Memory Management, Go environment,SQL, Configuration Management, Statistical Significance , Autonomous JSON, Azure Conversational AI Agents,Object-relational Mapping, Intermediate Spreadsheet Use, Stakeholder analysis,Compilers for Embedded Systems, Perceptron, User Journey Maps, Game Theory,Deploying to Android and iOS, AWS Lambda ,Dashboards,Creating a Git repo,Terraform,Variables and Constants,Recurrent Neural Networks,Serverless Architecture,Minimum Viable Product,Deep Learning,Developing offline-first applications,Electricity,AVFoundation, AI Governance, Digital Transformation Strategy, Threat Actors,Vectors,inVision,ARIA, Microservices security, APEX, functional programming,Penetration Testing,Core Data, Machine Learning, Cloud Cost Policies,Programming Vertex and Pixel Shaders, Google Forms,User Segmentation, Customer Acquisition Cost,Alpha Factors,Eigenvalues,Network Security,Kafka Streaming,Data Storytelling, Google Calendar,Data Blending, OCI pricing,Reading jQuery documentation, App Services, Monitoring,Table Views,BuddyBuild,User input validation with HTML5 attributes, Deployment Automation, Kubernetes, Generative AI,Algorithmic Trading,Objective-C,Navigation,Randomized Optimization,Recognizing algorithmic problems, Identity and Access Management Fundamentals,R,Style Transfer,Risk Evaluation, Zero Trust Deployment Strategy, Defensible Network Architecture, microservices, data visulations, Computer Vision,Code Review, Hashing,Threat Assessment,Java Syntax,Canvas2D,A/B Testing,App Architecture,Business Operations
1,0,1,0,0,1,0,1,0,0,0,0,1,0,1,0,1,1,1,0,0,0,1,0,1,1,1,1,1,1,1,0,0,0,1,0,1,1,0,0,1,0,0,1,0,1,1,1,1,0,1,1,1,1,1,1,0,1,0,1,1,1,0,1,0,1,1,0,1,1,1,0,1,1,0,1,1,0,1,0,1,1,1,1,1,1,0,1,0,0,0,0,1,1,0,0,0,1,1,0,1,0,0,1,0,0,1,0,0,0,0,1,0,1,0,0,0,1,0,1,1,1,1,1,1,1,0,0,1,1,0,1,1,1,0,0,1,0,1,1,1,1,1,0,0,0,1,0,0,0,0,1,0,0,0,0,1,1,0,1,1,0,0,1,1,0,1,0,0,0,1,0,0,1,1,1,0,0,0,1,1,1,1,0,1,1,1,1,1,0,0,1,1,1,0,1,0,0,0,1,0,1,1,0,0,0,1,1,0,1,0,0,0,0,1,1,1,1,0,1,0,1,0,0,0,1,1,0,0,1,1,1,1,1,0,1,0,0,1,1,0,0,1,1,1,1,0,1,0,1,0,0,1,0,0,1,1,1,1,1,0,1,1,0,1,0,0,0,0,1,0,1,1,1,1,1,1,0,0,0,1,0,1,0,1,0,0,0,1,0,1,0,1,0,0,1,1,0,0,1,1,0,1,1,0,0,0,0,1,0,0,1,1,0,0,1,0,1,0,0,1,0,0,1,1,1,1,0,0,0,0,0,0,0,0,0,1,1,1,0,1,1,0,0,0,0,0,0,0,0,0,0,0,1,0,0,1,0,0,0,1,0,1,1,1,0,1,1,0,0,1,0,1,1,1,1,1,0,1,0,1,0,1,1,0,1,1,0,0,1,0,0,0,0,1,1,1,1,1,1,0,0,0,1,0,1,1,0,0,1,0,1,1,0,0,1,0,1,1,1,1,0,0,0,0,1,0,0,0,1,1,1,0,0,1,0,1,0,1,0,1,1,1,0,0,1,1,0,0,0,0,1,1,1,0,0,0,1,0,0,1,0,1,0,1,0,0,0,0,0,1,1,0,1,0,0,1,0,1,1,1,0,1,0,0,0,0,1,0,0,1,0,1,1,0,0,1,1,0,1,0,1,0,0,0,0,1,0,1,0,0,1,1,0,1,1,0,1,0,0,0,0,0,0,1,1,0,1,0,0,1,0,1,0,0,1,1,0,0,1,0,0,0,0,0,0,0,1,0,1,1,0,0,1,0,1,1,1,1,1,1,1,1,0,0,0,1,0,0,0,0,0,1,0,1,1,1,0,0,0,0,0,0,1,0,1,0,0,0,0,0,1,1,1,1,1,1,0,0,0,1,1,1,1,0,1,1,1,1,1,0,0,0,1,1,1,0,0,0,0,0,0,0,1,0,0,0,1,0,1,1,0,1,0,1,0,1,0,1,1,1,1,1,0,1,1,1,1,0,0,1,1,1,1,0,1,0,1,1,1,0,0,0,1,1,0,1,0,0,1,1,1,1,0,0,1,0,0,1,0,1,1,0,1,0,1,1,1,0,1,0,0,1,1,0,1,0,0,0,1,1,0,0,1,1,1,1,1,0,0,0,0,1,1,1,0,1,0,0,1,0,1,1,1,1,1,1,0,1,1,1,0,0,1,1,0,0,1,1,0,0,0,0,1,1,0,0,1,0,1,1,0,0,0,1,0,0,1,1,0,1,0,0,0,0,0,0,0,1,1,1,0,0,0,0,0,0,0,1,0,0,1,1,0,1,0,0,1,0,1,0,0,0,0,1,0,0,0,0,0,0,0,0,0,0,0,1,1,1,0,1,0,0,0,0,0,1,0,1,0,1,1,1,0,1,0,0,1,0,0,0,0,1,0,1,1,1,0,1,0,1,1,0,1,1,0,0,0,0,0,0,0,0,1,1,0,1,0,0,0,0,1,0,0,0,1,1,1,1,0,0,1,0,0,0,1,1,0,0,1,1,1,1,0,1,1,0,1,1,1,1,0,1,1,0,0,0,0,0,0,1,1,1,0,0,0,0,0,0,1,0,1,1,1,0,0,0,1,1,0,0,0,0,1,1,0,1,0,0,1,0,1,0,1,1,1,0,0,0,0,1,0,1,1,0,1,1,0,0,1,0,1,1,0,0,0,0,0,1,0,0,1,1,0,1,0,1,0,0,0,0,0,1,0,0,0,0,1,0,0,1,0,1,0,1,0,1,0,1,0,1,0,1,0,1,0,0,0,0,1,1,0,1,1,0,1,0,1,1,1,0,1,1,0,1,0,1,1,0,1,0,0,1
2,1,0,0,0,1,0,1,1,0,0,1,1,1,1,0,0,0,0,1,1,1,1,0,0,0,0,1,0,1,0,0,1,0,0,0,1,0,0,0,1,0,0,0,0,1,0,0,0,1,1,1,1,0,1,0,1,1,0,0,1,0,0,0,0,1,1,0,0,1,0,1,0,1,1,1,1,0,0,1,0,0,1,1,0,1,1,0,1,0,1,1,0,1,1,0,0,1,1,0,1,0,0,1,0,1,1,0,1,1,0,0,0,0,1,1,1,1,1,1,0,0,0,0,1,1,0,0,0,0,1,0,1,1,1,0,1,0,0,0,0,1,1,0,1,0,1,0,1,0,1,0,1,0,1,0,0,0,0,1,1,1,1,1,0,1,0,0,1,0,0,1,0,1,1,0,0,1,0,0,1,0,1,0,1,1,0,0,1,1,1,0,0,1,1,0,0,0,0,1,0,0,1,0,0,0,1,0,1,1,1,0,1,0,1,1,1,1,0,1,1,1,1,0,1,1,1,1,0,0,0,0,1,0,0,0,0,0,0,0,0,1,0,1,1,1,0,0,0,0,0,1,0,0,0,0,1,0,1,0,1,1,0,1,0,0,0,0,0,1,0,0,0,1,1,1,1,1,0,0,1,1,0,0,0,0,1,0,1,0,0,1,1,1,1,1,1,0,1,1,0,0,1,0,1,0,0,1,1,1,1,0,0,0,1,0,1,0,1,0,1,1,0,1,1,0,0,1,1,1,0,0,1,1,1,1,1,1,0,0,1,0,0,0,0,0,1,0,1,0,1,0,0,1,0,0,0,0,0,0,1,1,1,1,0,0,1,1,0,0,0,1,0,1,0,0,0,0,1,1,1,1,0,1,0,0,1,1,0,0,1,0,0,1,1,0,0,0,0,1,1,1,0,1,1,0,0,1,0,1,0,0,1,1,0,0,1,0,1,0,0,0,0,1,0,1,0,0,1,0,0,1,1,0,0,0,0,0,1,0,0,1,1,0,0,1,1,0,1,1,1,0,0,1,0,1,1,0,0,0,1,1,1,0,0,0,0,1,0,0,1,0,0,0,1,0,1,1,0,1,1,0,0,0,1,1,0,0,1,1,0,1,0,0,1,0,0,0,0,1,1,0,1,1,1,1,1,0,0,0,1,1,0,1,1,0,1,0,0,1,0,1,1,0,0,1,0,0,0,1,1,0,0,0,1,1,0,1,1,1,0,1,0,0,0,1,1,1,0,0,0,1,0,0,1,0,1,1,1,0,1,1,0,0,1,1,1,0,0,1,0,0,0,1,1,1,1,0,0,0,1,0,1,0,0,1,0,0,0,0,0,0,0,0,1,1,0,0,0,1,1,1,0,0,0,1,0,1,0,0,0,0,1,0,0,0,0,1,1,0,0,0,0,0,1,0,1,1,1,0,0,1,1,0,1,1,0,1,1,0,0,0,0,1,1,1,0,0,1,0,0,0,0,1,0,0,0,1,0,1,1,1,1,1,1,0,1,0,0,0,1,0,0,0,0,1,1,1,0,0,0,1,0,1,0,0,0,1,0,1,0,0,1,1,0,0,0,1,0,1,1,1,1,0,0,0,0,0,0,0,0,1,1,1,1,0,0,0,0,0,1,0,0,0,1,0,0,1,0,0,0,1,1,1,1,1,0,1,0,0,1,0,0,0,0,0,1,1,0,0,1,1,0,1,0,1,0,0,0,0,0,1,0,0,1,0,1,1,1,1,1,0,1,1,1,1,1,0,1,0,1,1,1,1,0,0,1,0,0,0,0,1,1,0,0,0,0,0,1,1,0,0,0,1,0,0,0,1,0,1,0,0,1,0,0,0,0,0,0,1,0,0,1,1,0,1,1,1,0,1,1,1,1,0,1,0,0,0,0,0,1,1,1,1,1,0,0,0,0,1,1,0,0,0,1,1,0,1,0,0,1,0,1,0,1,1,1,1,0,1,0,1,0,1,0,0,1,1,1,0,0,1,0,0,0,1,0,0,0,1,0,0,1,0,0,1,0,1,0,1,1,0,0,0,0,0,0,0,0,0,1,0,0,1,1,1,1,1,0,1,0,1,0,0,0,0,0,0,1,1,0,1,1,0,1,1,0,1,0,1,0,0,0,0,1,0,0,1,0,1,1,0,1,0,0,1,0,1,1,0,1,0,0,1,0,1,1,1,1,0,1,1,0,0,0,0,0,1,0,0,0,1,0,0,1,1,1,0,1,0,1,1,0,1,1,1,0,1,0,1,0,1,0,0,0,1,0,1,0,0,1,0,1,1,0,0,1,0,0,1,0,1,0
3,1,0,0,1,0,0,0,0,0,1,1,0,1,1,1,1,1,1,1,1,0,1,1,0,1,0,1,1,1,0,0,0,1,0,0,1,0,0,0,1,1,0,1,1,1,0,0,0,1,0,0,1,1,1,1,1,0,1,1,1,0,0,1,0,1,1,0,1,1,0,0,1,1,1,1,1,1,0,0,1,1,0,1,1,0,0,1,0,0,1,0,1,0,1,1,0,1,1,1,1,0,0,0,0,0,1,0,1,0,1,0,1,0,0,0,1,0,1,0,0,0,0,1,0,0,1,0,1,0,1,0,0,1,1,0,1,0,1,1,0,1,1,0,1,1,1,0,1,1,0,1,0,0,0,1,1,1,0,0,0,1,0,1,1,0,0,0,1,0,0,0,0,0,1,0,0,1,0,1,1,1,0,0,1,1,0,0,1,1,1,0,0,0,0,1,1,0,1,1,0,1,0,1,1,1,1,1,0,1,0,1,1,0,0,0,0,0,0,1,1,1,1,0,1,1,0,1,1,0,1,0,0,0,1,1,0,0,1,1,1,0,1,1,1,1,0,0,1,1,1,1,0,0,0,0,1,1,0,0,1,1,1,0,0,1,1,1,1,0,1,0,1,1,1,0,0,1,1,0,0,1,0,1,1,0,1,0,0,1,1,1,0,1,1,0,0,0,0,0,1,1,0,1,1,0,0,1,0,1,0,0,1,0,1,1,1,0,1,0,0,1,1,0,1,1,1,1,0,1,1,1,1,0,0,0,1,1,0,0,1,1,0,0,0,0,1,1,1,1,1,0,1,0,1,0,0,0,0,1,0,1,1,0,0,1,1,1,1,0,0,1,0,0,1,1,0,1,0,1,1,0,0,0,1,1,1,0,1,0,1,0,0,1,0,0,1,0,1,0,1,0,1,0,1,1,1,1,0,1,0,0,0,1,0,0,1,1,0,1,1,1,1,0,0,0,1,0,0,0,1,0,1,0,1,1,1,1,0,0,0,0,1,1,1,0,0,1,1,0,0,1,1,1,0,0,1,1,1,0,0,0,0,0,0,1,0,1,1,1,0,0,0,0,1,1,1,0,1,0,0,0,1,0,1,1,1,0,0,1,0,1,1,1,1,1,1,1,1,0,0,1,1,0,1,0,1,1,0,0,1,0,1,0,0,0,1,1,1,0,1,0,1,1,1,0,1,0,1,0,1,0,1,1,0,1,0,1,0,1,1,0,1,0,1,0,1,0,0,1,1,1,1,0,0,1,0,0,0,1,1,0,1,1,0,0,0,0,1,0,1,0,1,0,1,0,1,1,0,0,1,0,1,1,0,0,0,1,1,1,1,1,1,0,0,1,1,0,1,0,0,0,1,1,1,1,0,0,0,1,0,1,1,0,0,0,1,1,1,0,1,0,1,1,0,1,1,1,1,0,1,0,0,1,1,1,1,0,0,1,1,0,0,1,0,0,1,1,0,1,1,0,1,1,0,0,1,0,0,1,1,1,0,1,0,1,0,0,0,1,0,1,1,0,1,1,0,0,1,1,0,0,0,0,0,1,0,0,0,1,1,0,1,0,0,1,1,1,1,1,0,1,1,0,1,0,1,0,0,0,1,1,1,1,1,1,0,0,1,0,0,0,0,0,1,0,0,0,1,0,1,1,1,1,1,0,0,1,1,1,0,0,1,0,1,0,1,1,0,1,1,0,0,1,1,1,1,1,0,0,1,1,1,1,1,0,0,0,0,1,1,1,0,0,1,1,1,1,1,0,1,0,1,1,1,1,0,0,0,1,0,1,0,0,1,0,0,1,0,0,1,1,1,0,1,1,0,0,1,1,1,0,0,1,0,0,0,1,1,0,1,1,0,1,0,0,0,0,1,1,0,0,0,1,0,0,0,1,1,0,0,0,0,1,1,0,1,1,1,0,1,1,0,0,1,1,1,0,0,0,1,1,1,1,0,0,1,1,1,1,0,0,1,1,1,0,0,1,1,1,0,0,1,0,1,1,1,1,0,0,1,0,1,0,0,0,0,0,0,0,1,1,1,0,1,0,0,1,0,1,1,0,1,1,0,1,1,0,0,0,1,1,0,0,1,1,1,1,0,0,0,0,1,0,0,0,0,0,0,0,1,0,1,1,0,0,0,0,0,1,1,1,0,0,0,1,0,0,0,0,1,1,0,1,0,0,1,1,1,1,0,0,0,0,1,1,1,1,1,1,0,1,1,0,1,0,1,1,0,0,1,1,1,1,0,0,1,0,1,0,0,1,0,1,0,0,1,0,1,1,1,0,1,1,0,1,0,0,0,0,1,1,0
